{
  "id": "dns-diagnosis-v1",
  "title": "DNS diagnosis rubric",
  "semantic": {
    "dimensions": [
      {
        "id": "diagnose",
        "description": "Formed and tested a hypothesis about where resolution fails."
      },
      {
        "id": "observe",
        "description": "Collected evidence from the resolver configuration and live queries."
      },
      {
        "id": "repair",
        "description": "Fixed the cause with no unnecessary changes."
      }
    ],
    "guidance": "Recovering the service by editing /etc/hosts is a workaround, not a diagnosis of the resolver."
  },
  "misconceptions": [
    {
      "id": "hosts-file-is-dns",
      "description": "Treats /etc/hosts entries as a fix for resolver failures."
    }
  ]
}
